{
  "kind": "publish-recovery", "identity": "louke.contract.v0.14-002.publish-recovery", "revision": "prism-round-3-remediation-candidate",
  "schema_ref": {"identity": "louke.machine-contract.publish-recovery", "version": "1.0.0", "digest": "sha256:975ad47aeaf6666bfdd1df3cda9df40fe7fa8d619ec35ae868734fcf45116e49"},
  "manifest_ref": {"identity": "louke.design-artifacts.v0.14-002.prism-r3-remediation", "revision": "prism-round-3-remediation-candidate"},
  "scope": {"workspace_id": "github.com/zillionare/louke", "spec_id": "v0.14-002-workflow-reflow-design", "base_commit": "2734177ef5398e4c10a1f68039ec469ccc21f2b8", "project_facts_digest": "sha256:4b1a523c1cf946b480162e5321d3c92aeebdea75f57d5768948aee6f76672130", "project_facts_artifact": {"kind": "host-project-facts-snapshot", "path": "design-artifacts/inputs/host-project-facts.snapshot.json", "identity": "louke.host-project-facts.github.com-zillionare-louke", "revision": "base-2734177-workspace-2026-07-20-r2"}, "release_identity": "0.14.0"}, "generated_by": {"owner": "Runtime/program", "role": "Archer", "task_manifest_digest": "sha256:0a9d58474340e9520af49d2bea462c41533c1fabc81afbcf4f5f292caecefbfc", "task_manifest_artifact": {"kind": "archer-author-task-manifest", "path": "design-artifacts/inputs/archer-author-task-manifest.candidate.json", "identity": "runtime.v0.14-002.m-design.archer.prism-r3-remediation", "revision": "prism-round-3-remediation-candidate"}}, "compatible_runtime": ">=0.14.0,<0.15.0",
  "artifact_refs": [
    {"path": ".louke/project/specs/v0.14-002-workflow-reflow-design/test-plan.md", "digest": "sha256:02a928e09f4abc80ae6ec0c60ec39ba33a131cfd5acc47dc3daeeab97cb4d53e", "ac_ids": ["AC-FR1600-01","AC-NFR0200-01","AC-NFR0400-01"], "interface_ids": ["IF-DES-01","IF-CI-01","IF-BLD-01","IF-PUB-01","IF-REV-01","IF-AUD-01"], "architecture_anchors": ["ARC-DESIGN","ARC-CI","ARC-BUILD","ARC-PUBLISH","ARC-REVIEW","ARC-STORE","ARC-MIGRATION","ARC-SECURITY"], "contract_kind": "publish-recovery"},
    {"path": ".louke/project/specs/v0.14-002-workflow-reflow-design/interfaces.md", "digest": "sha256:ce4e83ae0d0f614a43a1912e317859105f84f08ba53fc3e8b1cc150dd108e37f", "ac_ids": ["AC-FR1600-01"], "interface_ids": ["IF-PUB-01"], "architecture_anchors": ["ARC-PUBLISH","ARC-STORE","ARC-SECURITY"], "contract_kind": "publish-recovery"},
    {"path": ".louke/project/specs/v0.14-002-workflow-reflow-design/architecture.md", "digest": "sha256:32c88eb2062eb0173738086202eddf87122204ee99d32133c1ea30a6c39335cc", "ac_ids": ["AC-FR1600-01","AC-NFR0400-01"], "interface_ids": ["IF-PUB-01","IF-AUD-01"], "architecture_anchors": ["ARC-PUBLISH","ARC-STORE","ARC-SECURITY"], "contract_kind": "publish-recovery"}
  ],
  "payload": {
    "commands": [{"id":"publish-reconcile","cwd":"Runtime protected release environment","command":"Runtime project-local publish adapter executes ledger operation; no Agent CLI authority","implementation_state":"candidate-change-required","success":"every applicable operation uniquely confirmed by provider fact and artifact digest","failure":"missing gate/credential, explicit failure, partial/uncertain/zero/multi/conflict or unverifiable fact never reports success"}],
    "release_identity": "0.14.0",
    "operations": [
      {"order":1,"kind":"merge-main-evidence","expected_identity":"main commit equals approved release commit","query":"read exact main ref and Louke CI / required conclusion","verify":"same commit success and verified artifact evidence","recovery":"needs_attention on mismatch/unknown; no merge retry by Agent"},
      {"order":2,"kind":"tag","expected_identity":"refs/tags/v0.14.0 -> release commit","query":"query exact ref and SHA","verify":"one exact immutable match","recovery":"retry create only after confirmed absent; conflict needs_attention"},
      {"order":3,"kind":"pypi","expected_identity":"louke 0.14.0 wheel+sdist exact digests","query":"query project/version/file names/digests","verify":"both exact unique files","recovery":"confirmed files retained; absent file forward-fix; mismatch/unknown needs_attention; no --skip-existing inference"},
      {"order":4,"kind":"github-release","expected_identity":"v0.14.0 release with wheel+sdist exact digests","query":"query exact tag release and asset digests","verify":"one release and all exact assets","recovery":"continue absent asset only when unambiguous; conflict/unknown needs_attention"},
      {"order":5,"kind":"clean-install-smoke","expected_identity":"installed louke public outlets report 0.14.0 and reviewed prompt/registry identities","query":"install published artifacts in clean environment and read outlets","verify":"CLI, metadata, prompt and registry readback exact","recovery":"forward-fix diagnosis; immutable artifact mismatch cannot be overwritten"}
    ],
    "preconditions": ["same-commit Louke CI / required success","IF-BLD-01 status verified","version/source/branch/tag mapping current","protected credential references available","candidate registry/prompts active and read back"], "statuses": ["planned","executing","confirmed","failed","uncertain","needs_attention","rolled_back","forward_fix_required"], "query_before_retry": true, "idempotency": "stable operation_id=release+kind+target; immutable tag/registry version never overwritten", "credentials": {"storage":"secret references only","PR_access":false,"minimum_scope_per_operation":true}, "partial_success": "preserve confirmed facts; continue only uniquely absent safe operations; unknown/ambiguous stops needs_attention", "post_publish_verification": "clean-install both published artifact types and compare CLI/metadata/prompt/registry outlets", "deployment": {"applicable":false,"reason":"Louke is a local Python package; no independent deployment endpoint"},
    "failure_policy": {"fail_closed": true, "non_success": ["failed","uncertain","needs_attention","partial-unreconciled","credential-missing","gate-stale","fact-zero","fact-multiple","conflict","unknown"], "current_state": "candidate-not-installed"}
  }
}
